docs/universe_benchmark_results.json

[
  {
    "Asset":"BTCUSDT",
    "Model":"Buy & Hold",
    "Return (%)":0.13,
    "Sharpe":0.22,
    "Sortino":0.3,
    "Max DD (%)":6.45,
    "Trades":1,
    "Win Rate (%)":100.0,
    "Profit Factor":99.0
  },
  {
    "Asset":"BTCUSDT",
    "Model":"Moving Average (20\/50)",
    "Return (%)":-3.27,
    "Sharpe":-2.55,
    "Sortino":-2.32,
    "Max DD (%)":7.57,
    "Trades":6,
    "Win Rate (%)":50.0,
    "Profit Factor":0.53
  },
  {
    "Asset":"BTCUSDT",
    "Model":"Random Forest",
    "Return (%)":-0.51,
    "Sharpe":-4.16,
    "Sortino":-0.71,
    "Max DD (%)":0.75,
    "Trades":2,
    "Win Rate (%)":50.0,
    "Profit Factor":0.53
  },
  {
    "Asset":"BTCUSDT",
    "Model":"LightGBM",
    "Return (%)":-2.12,
    "Sharpe":-6.29,
    "Sortino":-1.6,
    "Max DD (%)":2.67,
    "Trades":9,
    "Win Rate (%)":55.6,
    "Profit Factor":0.57
  },
  {
    "Asset":"ETHUSDT",
    "Model":"Buy & Hold",
    "Return (%)":1.92,
    "Sharpe":0.97,
    "Sortino":1.33,
    "Max DD (%)":6.69,
    "Trades":1,
    "Win Rate (%)":100.0,
    "Profit Factor":99.0
  },
  {
    "Asset":"ETHUSDT",
    "Model":"Moving Average (20\/50)",
    "Return (%)":1.23,
    "Sharpe":0.81,
    "Sortino":0.8,
    "Max DD (%)":8.86,
    "Trades":8,
    "Win Rate (%)":37.5,
    "Profit Factor":1.62
  },
  {
    "Asset":"ETHUSDT",
    "Model":"Random Forest",
    "Return (%)":0.0,
    "Sharpe":0.0,
    "Sortino":0.0,
    "Max DD (%)":0.0,
    "Trades":0,
    "Win Rate (%)":0.0,
    "Profit Factor":0.0
  },
  {
    "Asset":"ETHUSDT",
    "Model":"LightGBM",
    "Return (%)":-1.86,
    "Sharpe":-2.43,
    "Sortino":-0.77,
    "Max DD (%)":4.0,
    "Trades":22,
    "Win Rate (%)":72.7,
    "Profit Factor":1.17
  },
  {
    "Asset":"SOLUSDT",
    "Model":"Buy & Hold",
    "Return (%)":-4.64,
    "Sharpe":-1.88,
    "Sortino":-2.56,
    "Max DD (%)":9.64,
    "Trades":1,
    "Win Rate (%)":0.0,
    "Profit Factor":0.0
  },
  {
    "Asset":"SOLUSDT",
    "Model":"Moving Average (20\/50)",
    "Return (%)":-1.1,
    "Sharpe":-0.54,
    "Sortino":-0.55,
    "Max DD (%)":7.49,
    "Trades":5,
    "Win Rate (%)":60.0,
    "Profit Factor":0.88
  },
  {
    "Asset":"SOLUSDT",
    "Model":"Random Forest",
    "Return (%)":0.05,
    "Sharpe":0.55,
    "Sortino":0.22,
    "Max DD (%)":0.31,
    "Trades":3,
    "Win Rate (%)":66.7,
    "Profit Factor":7.1
  },
  {
    "Asset":"SOLUSDT",
    "Model":"LightGBM",
    "Return (%)":-1.22,
    "Sharpe":-1.49,
    "Sortino":-0.84,
    "Max DD (%)":3.89,
    "Trades":32,
    "Win Rate (%)":62.5,
    "Profit Factor":1.64
  },
  {
    "Asset":"BNBUSDT",
    "Model":"Buy & Hold",
    "Return (%)":2.08,
    "Sharpe":1.41,
    "Sortino":2.02,
    "Max DD (%)":4.23,
    "Trades":1,
    "Win Rate (%)":100.0,
    "Profit Factor":99.0
  },
  {
    "Asset":"BNBUSDT",
    "Model":"Moving Average (20\/50)",
    "Return (%)":2.2,
    "Sharpe":1.95,
    "Sortino":2.01,
    "Max DD (%)":2.98,
    "Trades":5,
    "Win Rate (%)":40.0,
    "Profit Factor":2.97
  },
  {
    "Asset":"BNBUSDT",
    "Model":"Random Forest",
    "Return (%)":0.0,
    "Sharpe":0.0,
    "Sortino":0.0,
    "Max DD (%)":0.0,
    "Trades":0,
    "Win Rate (%)":0.0,
    "Profit Factor":0.0
  },
  {
    "Asset":"BNBUSDT",
    "Model":"LightGBM",
    "Return (%)":-3.17,
    "Sharpe":-8.01,
    "Sortino":-2.04,
    "Max DD (%)":3.29,
    "Trades":9,
    "Win Rate (%)":22.2,
    "Profit Factor":0.2
  },
  {
    "Asset":"XRPUSDT",
    "Model":"Buy & Hold",
    "Return (%)":-4.49,
    "Sharpe":-2.01,
    "Sortino":-2.87,
    "Max DD (%)":9.89,
    "Trades":1,
    "Win Rate (%)":0.0,
    "Profit Factor":0.0
  },
  {
    "Asset":"XRPUSDT",
    "Model":"Moving Average (20\/50)",
    "Return (%)":-3.66,
    "Sharpe":-2.42,
    "Sortino":-2.41,
    "Max DD (%)":7.88,
    "Trades":8,
    "Win Rate (%)":12.5,
    "Profit Factor":0.6
  },
  {
    "Asset":"XRPUSDT",
    "Model":"Random Forest",
    "Return (%)":-1.61,
    "Sharpe":-6.6,
    "Sortino":-1.01,
    "Max DD (%)":1.61,
    "Trades":4,
    "Win Rate (%)":50.0,
    "Profit Factor":0.13
  },
  {
    "Asset":"XRPUSDT",
    "Model":"LightGBM",
    "Return (%)":-0.8,
    "Sharpe":-2.31,
    "Sortino":-1.23,
    "Max DD (%)":2.22,
    "Trades":20,
    "Win Rate (%)":55.0,
    "Profit Factor":1.95
  },
  {
    "Asset":"DOGEUSDT",
    "Model":"Buy & Hold",
    "Return (%)":13.56,
    "Sharpe":3.88,
    "Sortino":5.42,
    "Max DD (%)":9.33,
    "Trades":1,
    "Win Rate (%)":100.0,
    "Profit Factor":99.0
  },
  {
    "Asset":"DOGEUSDT",
    "Model":"Moving Average (20\/50)",
    "Return (%)":7.15,
    "Sharpe":2.54,
    "Sortino":3.07,
    "Max DD (%)":8.41,
    "Trades":7,
    "Win Rate (%)":57.1,
    "Profit Factor":3.07
  },
  {
    "Asset":"DOGEUSDT",
    "Model":"Random Forest",
    "Return (%)":3.55,
    "Sharpe":3.69,
    "Sortino":2.87,
    "Max DD (%)":0.65,
    "Trades":2,
    "Win Rate (%)":50.0,
    "Profit Factor":8.98
  },
  {
    "Asset":"DOGEUSDT",
    "Model":"LightGBM",
    "Return (%)":7.46,
    "Sharpe":5.35,
    "Sortino":6.89,
    "Max DD (%)":2.25,
    "Trades":23,
    "Win Rate (%)":52.2,
    "Profit Factor":6.26
  },
  {
    "Asset":"ADAUSDT",
    "Model":"Buy & Hold",
    "Return (%)":-21.48,
    "Sharpe":-4.55,
    "Sortino":-6.2,
    "Max DD (%)":26.17,
    "Trades":1,
    "Win Rate (%)":0.0,
    "Profit Factor":0.0
  },
  {
    "Asset":"ADAUSDT",
    "Model":"Moving Average (20\/50)",
    "Return (%)":-0.49,
    "Sharpe":-0.06,
    "Sortino":-0.06,
    "Max DD (%)":9.26,
    "Trades":4,
    "Win Rate (%)":50.0,
    "Profit Factor":1.03
  },
  {
    "Asset":"ADAUSDT",
    "Model":"Random Forest",
    "Return (%)":1.6,
    "Sharpe":0.84,
    "Sortino":0.45,
    "Max DD (%)":10.07,
    "Trades":18,
    "Win Rate (%)":72.2,
    "Profit Factor":1.47
  },
  {
    "Asset":"ADAUSDT",
    "Model":"LightGBM",
    "Return (%)":0.39,
    "Sharpe":0.36,
    "Sortino":0.23,
    "Max DD (%)":12.97,
    "Trades":48,
    "Win Rate (%)":68.8,
    "Profit Factor":1.3
  },
  {
    "Asset":"AVAXUSDT",
    "Model":"Buy & Hold",
    "Return (%)":0.38,
    "Sharpe":0.39,
    "Sortino":0.52,
    "Max DD (%)":11.5,
    "Trades":1,
    "Win Rate (%)":100.0,
    "Profit Factor":99.0
  },
  {
    "Asset":"AVAXUSDT",
    "Model":"Moving Average (20\/50)",
    "Return (%)":-3.34,
    "Sharpe":-1.3,
    "Sortino":-1.11,
    "Max DD (%)":7.69,
    "Trades":7,
    "Win Rate (%)":42.9,
    "Profit Factor":0.76
  },
  {
    "Asset":"AVAXUSDT",
    "Model":"Random Forest",
    "Return (%)":4.18,
    "Sharpe":3.47,
    "Sortino":1.32,
    "Max DD (%)":2.96,
    "Trades":21,
    "Win Rate (%)":71.4,
    "Profit Factor":3.18
  },
  {
    "Asset":"AVAXUSDT",
    "Model":"LightGBM",
    "Return (%)":12.55,
    "Sharpe":7.57,
    "Sortino":6.45,
    "Max DD (%)":2.92,
    "Trades":54,
    "Win Rate (%)":75.9,
    "Profit Factor":3.21
  },
  {
    "Asset":"LINKUSDT",
    "Model":"Buy & Hold",
    "Return (%)":-30.05,
    "Sharpe":-5.36,
    "Sortino":-6.98,
    "Max DD (%)":32.94,
    "Trades":1,
    "Win Rate (%)":0.0,
    "Profit Factor":0.0
  },
  {
    "Asset":"LINKUSDT",
    "Model":"Moving Average (20\/50)",
    "Return (%)":-29.53,
    "Sharpe":-10.82,
    "Sortino":-7.56,
    "Max DD (%)":30.84,
    "Trades":8,
    "Win Rate (%)":0.0,
    "Profit Factor":0.0
  },
  {
    "Asset":"LINKUSDT",
    "Model":"Random Forest",
    "Return (%)":-9.69,
    "Sharpe":-3.47,
    "Sortino":-2.03,
    "Max DD (%)":11.18,
    "Trades":39,
    "Win Rate (%)":53.8,
    "Profit Factor":0.79
  },
  {
    "Asset":"LINKUSDT",
    "Model":"LightGBM",
    "Return (%)":-8.82,
    "Sharpe":-2.53,
    "Sortino":-2.17,
    "Max DD (%)":18.1,
    "Trades":76,
    "Win Rate (%)":50.0,
    "Profit Factor":1.02
  },
  {
    "Asset":"NEARUSDT",
    "Model":"Buy & Hold",
    "Return (%)":40.64,
    "Sharpe":5.28,
    "Sortino":8.89,
    "Max DD (%)":14.53,
    "Trades":1,
    "Win Rate (%)":100.0,
    "Profit Factor":99.0
  },
  {
    "Asset":"NEARUSDT",
    "Model":"Moving Average (20\/50)",
    "Return (%)":-0.24,
    "Sharpe":0.44,
    "Sortino":0.54,
    "Max DD (%)":18.18,
    "Trades":8,
    "Win Rate (%)":37.5,
    "Profit Factor":1.14
  },
  {
    "Asset":"NEARUSDT",
    "Model":"Random Forest",
    "Return (%)":2.65,
    "Sharpe":1.24,
    "Sortino":0.81,
    "Max DD (%)":9.46,
    "Trades":25,
    "Win Rate (%)":52.0,
    "Profit Factor":1.43
  },
  {
    "Asset":"NEARUSDT",
    "Model":"LightGBM",
    "Return (%)":33.67,
    "Sharpe":8.17,
    "Sortino":9.25,
    "Max DD (%)":12.22,
    "Trades":57,
    "Win Rate (%)":70.2,
    "Profit Factor":2.61
  },
  {
    "Asset":"LTCUSDT",
    "Model":"Buy & Hold",
    "Return (%)":-7.81,
    "Sharpe":-1.22,
    "Sortino":-1.54,
    "Max DD (%)":21.28,
    "Trades":1,
    "Win Rate (%)":0.0,
    "Profit Factor":0.0
  },
  {
    "Asset":"LTCUSDT",
    "Model":"Moving Average (20\/50)",
    "Return (%)":-2.33,
    "Sharpe":-0.5,
    "Sortino":-0.53,
    "Max DD (%)":13.88,
    "Trades":6,
    "Win Rate (%)":33.3,
    "Profit Factor":0.73
  },
  {
    "Asset":"LTCUSDT",
    "Model":"Random Forest",
    "Return (%)":-10.92,
    "Sharpe":-4.04,
    "Sortino":-1.94,
    "Max DD (%)":10.92,
    "Trades":30,
    "Win Rate (%)":53.3,
    "Profit Factor":0.6
  },
  {
    "Asset":"LTCUSDT",
    "Model":"LightGBM",
    "Return (%)":-3.96,
    "Sharpe":-1.02,
    "Sortino":-0.78,
    "Max DD (%)":9.2,
    "Trades":60,
    "Win Rate (%)":56.7,
    "Profit Factor":1.14
  },
  {
    "Asset":"DOTUSDT",
    "Model":"Buy & Hold",
    "Return (%)":15.57,
    "Sharpe":2.9,
    "Sortino":4.62,
    "Max DD (%)":24.62,
    "Trades":1,
    "Win Rate (%)":100.0,
    "Profit Factor":99.0
  },
  {
    "Asset":"DOTUSDT",
    "Model":"Moving Average (20\/50)",
    "Return (%)":-2.49,
    "Sharpe":-0.13,
    "Sortino":-0.14,
    "Max DD (%)":19.75,
    "Trades":8,
    "Win Rate (%)":12.5,
    "Profit Factor":1.03
  },
  {
    "Asset":"DOTUSDT",
    "Model":"Random Forest",
    "Return (%)":-2.34,
    "Sharpe":-1.53,
    "Sortino":-1.19,
    "Max DD (%)":5.5,
    "Trades":21,
    "Win Rate (%)":42.9,
    "Profit Factor":1.04
  },
  {
    "Asset":"DOTUSDT",
    "Model":"LightGBM",
    "Return (%)":-1.89,
    "Sharpe":-0.72,
    "Sortino":-0.58,
    "Max DD (%)":7.27,
    "Trades":31,
    "Win Rate (%)":51.6,
    "Profit Factor":1.19
  },
  {
    "Asset":"SUIUSDT",
    "Model":"Buy & Hold",
    "Return (%)":-8.82,
    "Sharpe":-1.56,
    "Sortino":-2.21,
    "Max DD (%)":19.24,
    "Trades":1,
    "Win Rate (%)":0.0,
    "Profit Factor":0.0
  },
  {
    "Asset":"SUIUSDT",
    "Model":"Moving Average (20\/50)",
    "Return (%)":-16.99,
    "Sharpe":-5.46,
    "Sortino":-4.7,
    "Max DD (%)":17.45,
    "Trades":7,
    "Win Rate (%)":42.9,
    "Profit Factor":0.08
  },
  {
    "Asset":"SUIUSDT",
    "Model":"Random Forest",
    "Return (%)":5.34,
    "Sharpe":7.39,
    "Sortino":2.88,
    "Max DD (%)":1.14,
    "Trades":10,
    "Win Rate (%)":90.0,
    "Profit Factor":42.46
  },
  {
    "Asset":"SUIUSDT",
    "Model":"LightGBM",
    "Return (%)":9.46,
    "Sharpe":5.11,
    "Sortino":3.55,
    "Max DD (%)":4.06,
    "Trades":36,
    "Win Rate (%)":77.8,
    "Profit Factor":2.81
  }
]

RESULTS.md

### Selected Top-Performing Asset Highlights

* **AVAX/USDT**: LightGBM achieved **+12.55% return**, **7.57 Sharpe**, **75.9% win rate**, and **3.21 profit factor** with only 2.92% maximum drawdown.
* **NEAR/USDT**: LightGBM achieved **+33.67% return**, **8.17 Sharpe**, **70.2% win rate**, and **2.61 profit factor**.
* **DOGE/USDT**: LightGBM generated **+7.46% return**, **5.35 Sharpe**, and **6.26 profit factor** while cutting drawdown from 9.33% down to 2.25%.
* **SUI/USDT**: Random Forest generated **+5.34% return** with **7.39 Sharpe**, **90.0% win rate**, and **42.46 profit factor** with only 1.14% drawdown.